{
  "schemaVersion": "1.0",
  "kit": {
    "name": "moo-ui-generic-host-conformance-kit",
    "bootstrapRange": ">=5.3.0 <5.4",
    "scopeClass": "moo-ui",
    "themeAttribute": "data-bs-theme",
    "fixtures": [
      {
        "name": "static-primitives",
        "path": "static-primitives.html",
        "cssRecipe": "scoped",
        "bootstrapJs": false,
        "notes": "Non-interactive primitives (Button, Badge, Card, Avatar, Typography). Must include host content outside the .moo-ui wrapper for scoping probes."
      },
      {
        "name": "forms",
        "path": "forms.html",
        "cssRecipe": "scoped",
        "bootstrapJs": false,
        "notes": "Field/Input/Textarea/Select/Checkbox/Radio Group/Switch proving native form-control theming. Must include host content outside the .moo-ui wrapper for scoping probes."
      },
      {
        "name": "bootstrap-data-api",
        "path": "bootstrap-data-api.html",
        "cssRecipe": "scoped",
        "bootstrapJs": true,
        "notes": "Dropdown Menu, Collapsible, Tabs driven entirely by Bootstrap's Data API; no Moo ESM. Must include host content outside the .moo-ui wrapper for scoping probes."
      },
      {
        "name": "overlays",
        "path": "overlays.html",
        "cssRecipe": "scoped",
        "bootstrapJs": true,
        "notes": "Dialog, Tooltip, Popover: focus, backdrop, layering, and close behavior for Bootstrap-plugin-owned overlays. Must include host content outside the .moo-ui wrapper for scoping probes."
      },
      {
        "name": "moo-esm",
        "path": "moo-esm.html",
        "cssRecipe": "scoped",
        "bootstrapJs": true,
        "mooEsm": [
          "combobox.js",
          "sidebar.js"
        ],
        "notes": "Combobox and Sidebar with explicit getOrCreateInstance initialization; initialization lives in a standalone external script file so it is independently blockable for the lifecycle two-pass check and the fixture stays strict-CSP clean. Must include host content outside the .moo-ui wrapper for scoping probes."
      }
    ]
  },
  "cssRecipes": [
    {
      "name": "scoped",
      "description": "Documented scoped gradual-adoption recipe: the host's Bootstrap stylesheet first, then Moo UI's scoped component layer, components wrapped in .moo-ui. Chosen as the kit's canonical recipe because host conformance is about embedding Moo UI into an existing host, and this recipe exercises the @scope (.moo-ui) boundary the scoping category checks.",
      "stylesheets": [
        "bootstrap.min.css",
        "moo.css"
      ]
    },
    {
      "name": "full",
      "description": "Documented full-replacement recipe: moo-ui.css replaces the host's Bootstrap stylesheet entirely. Recorded for contract completeness; the kit's fixtures use the scoped recipe.",
      "stylesheets": [
        "moo-ui.css"
      ]
    }
  ],
  "categories": [
    {
      "id": "css-reset",
      "title": "CSS reset",
      "description": "Bootstrap's reboot arrives intact through the host's stylesheet pipeline, so Moo components render on the documented reset baseline.",
      "mechanism": "Computed-style assertions on in-scope elements: box-sizing must be border-box on every element inside the .moo-ui wrapper (reboot universal rule), and headings inside the scope must show reboot's zeroed top margin. Pure getComputedStyle checks; no human judgment.",
      "assertions": [
        {
          "id": "reboot-box-sizing",
          "check": "computed-equals",
          "fixtures": [
            "static-primitives",
            "forms",
            "bootstrap-data-api",
            "overlays",
            "moo-esm"
          ],
          "description": "Every element inside the .moo-ui wrapper computes box-sizing to border-box, except elements Bootstrap's own CSS explicitly opts out of the reboot for (btn-close, which Bootstrap sets to content-box by design).",
          "params": {
            "selectorAll": ".moo-ui *",
            "excludeSelector": ".btn-close",
            "property": "box-sizing",
            "expected": "border-box"
          }
        },
        {
          "id": "reboot-heading-margin",
          "check": "computed-equals",
          "fixtures": [
            "static-primitives"
          ],
          "description": "A heading inside the .moo-ui wrapper computes margin-top to 0px, proving reboot heading normalization survived the host pipeline.",
          "params": {
            "selector": ".moo-ui h2",
            "property": "margin-top",
            "expected": "0px"
          }
        }
      ]
    },
    {
      "id": "asset-order",
      "title": "Asset order",
      "description": "The documented stylesheet cascade holds on the host: Moo UI's documented overrides win over Bootstrap defaults inside the scope, and the recipe's stylesheets are actually loaded.",
      "mechanism": "Cascade-correctness outcomes are the contract, not literal request order: a host may concatenate or inline assets, so request order is only checked (and recorded as evidence) when the host serves the recipe as discrete stylesheets; an inlined or concatenated host is judged on the cascade outcome alone.",
      "assertions": [
        {
          "id": "moo-override-wins",
          "check": "computed-equals",
          "fixtures": [
            "static-primitives",
            "forms"
          ],
          "description": "An in-scope .btn btn-primary computes background-color to Moo UI's primary token (#171717, --moo-primary), not Bootstrap's default blue, proving Moo's layer wins the documented cascade regardless of how the host delivered it. The computed value reflects the later theme-aware button rule in moo.css, which overrides the earlier $primary-derived rule at equal specificity.",
          "params": {
            "selector": ".moo-ui .btn.btn-primary",
            "property": "background-color",
            "expected": "rgb(23, 23, 23)"
          }
        },
        {
          "id": "recipe-stylesheets-loaded",
          "check": "stylesheets-loaded",
          "fixtures": [
            "static-primitives",
            "forms",
            "bootstrap-data-api",
            "overlays",
            "moo-esm"
          ],
          "description": "Every stylesheet named in the fixture's cssRecipe is present in the loaded document's stylesheets (matched by basename). Skipped with a recorded reason when the host concatenates or inlines styles and no discrete recipe stylesheets are observable; on such hosts moo-override-wins is the sole cascade judge, as the category mechanism states.",
          "params": {
            "matchBy": "basename",
            "skipWhenConcatenated": true
          }
        },
        {
          "id": "discrete-recipe-order",
          "check": "request-order",
          "fixtures": [
            "static-primitives",
            "forms",
            "bootstrap-data-api",
            "overlays",
            "moo-esm"
          ],
          "description": "When the host serves the recipe as discrete stylesheet files, they are requested in the cssRecipe's documented order (bootstrap.min.css before moo.css). Skipped with a recorded reason when the host concatenates or inlines styles, since no request order exists to check there.",
          "params": {
            "skipWhenConcatenated": true
          }
        }
      ]
    },
    {
      "id": "scoping",
      "title": "Scoping",
      "description": "Moo UI's scoped layer changes nothing in host content outside the .moo-ui boundary (as sampled by the documented probes) and demonstrably changes things inside it. Overlay backdrops are styled globally by design because Bootstrap teleports modals and offcanvas to the body; that is expected, not a scoping violation.",
      "mechanism": "Two-pass comparison by the runner: load the fixture normally and record computed styles of out-of-scope probe elements, then reload with the moo.css stylesheet request blocked via route interception and record the same values; the two recordings must be identical for out-of-scope probes while at least one in-scope control element must differ. Hosts that concatenate Moo CSS with host styles cannot isolate the stylesheet, in which case the assertion is skipped with a recorded reason rather than forced.",
      "assertions": [
        {
          "id": "out-of-scope-untouched",
          "check": "scoped-style-diff",
          "fixtures": [
            "static-primitives",
            "forms",
            "bootstrap-data-api",
            "overlays",
            "moo-esm"
          ],
          "description": "Computed styles of host content outside the .moo-ui wrapper (heading, paragraph, link, list, plain button probes) are byte-identical across the moo.css-loaded and moo.css-blocked passes.",
          "params": {
            "selectorAll": "[data-conformance-probe]",
            "properties": [
              "color",
              "background-color",
              "font-family",
              "font-size",
              "margin-top",
              "padding-left",
              "border-top-width"
            ],
            "expect": "identical"
          }
        },
        {
          "id": "in-scope-changed",
          "check": "scoped-style-diff",
          "fixtures": [
            "static-primitives",
            "forms",
            "bootstrap-data-api",
            "overlays",
            "moo-esm"
          ],
          "description": "At least one in-scope control element's computed styles differ between the two passes, proving the block was effective and Moo's scoped layer actually applies inside .moo-ui.",
          "params": {
            "selector": ".moo-ui [data-conformance-control]",
            "properties": [
              "background-color",
              "border-radius"
            ],
            "expect": "different"
          }
        }
      ]
    },
    {
      "id": "theme",
      "title": "Theme",